{
  "$schema": "https://json-schema.org/draft-07/schema#",
  "title": "audit",
  "type": "object",
  "required": ["case", "trial", "executor", "candidate_findings", "case_feedback"],
  "additionalProperties": false,
  "properties": {
    "case": {"type": "string"},
    "trial": {"type": "string"},
    "executor": {"type": "string"},
    "candidate_findings": {
      "type": "array",
      "items": {
        "type": "object",
        "required": ["id", "class", "doctrine_anchor", "evidence_quote", "severity", "rationale", "needs_baseline_arm"],
        "additionalProperties": false,
        "properties": {
          "id": {"type": "string"},
          "class": {"type": "string", "enum": ["V", "B", "G", "C"]},
          "doctrine_anchor": {"type": "string"},
          "evidence_quote": {"type": "string"},
          "severity": {"type": "string", "enum": ["high", "medium", "low"]},
          "rationale": {"type": "string"},
          "needs_baseline_arm": {"type": "boolean"}
        }
      }
    },
    "case_feedback": {"type": ["string", "null"], "enum": ["trap-too-weak", null]}
  }
}
